{
  "id": "vultr-hp-1gb",
  "provider_id": "vultr",
  "family_id": "vultr-high-performance",
  "merchant_plan_code": "vhp-1c-1gb-amd",
  "name": "High Performance 1 GB",
  "product_type": "cloud_compute",
  "status": "active",
  "merchant_url": "https://www.vultr.com/products/cloud-compute/",
  "resources": {
    "vcpu": 1,
    "ram_mb": 1024,
    "storage_gb": 25,
    "storage_type": "nvme",
    "bandwidth_gb": 2048,
    "virtualization": null,
    "sites": null,
    "sites_unlimited": false,
    "monthly_visits": null,
    "server_bandwidth_gb": null,
    "cdn_bandwidth_gb": null,
    "php_workers": null,
    "gpu_model": null,
    "gpu_vram_gb": null
  },
  "billing": {
    "model": "hourly",
    "hourly_available": true,
    "minimum_term_months": null
  },
  "management": {
    "level": "self-managed",
    "panel": "Cloud console"
  },
  "platform": {
    "wordpress": true,
    "woocommerce": true,
    "linux": true,
    "windows": false,
    "game_server": true
  },
  "network": {
    "ipv4": null,
    "ipv6": null
  },
  "verification": {
    "status": "verified",
    "last_verified_at": "2026-09-08",
    "source_ids": [
      "vultr-pricing-official-2026-09-08",
      "vultr-plans-api-2026-09-08",
      "vultr-billing-docs-2026-09-08"
    ],
    "notes": "Official High Performance AMD/Intel 1 GB catalog: $6/mo, $0.009/hr displayed. AMD SKU vhp-1c-1gb-amd; Intel SKU shares the same monthly cap."
  }
}
